<?xml version="1.0" encoding="UTF-8"?>
<!DOCTYPE voters SYSTEM "voter.dtd">
<voters>
    <voter>
        <voterID>V123456</voterID>
        <name>John Doe</name>
        <address>123 Main St, Springfield, IL</address>
        <dateOfBirth>1990-05-15</dateOfBirth>
    </voter>
    <voter>
        <voterID>V987654</voterID>
        <name>Jane Smith</name>
        <address>456 Elm St, Springfield, IL</address>
        <dateOfBirth>1985-10-20</dateOfBirth>
    </voter>
</voters>
